flower_img_url,name,common_name,scientific_name,description,bloom_start,bloom_end,habitat
http://extension.colostate.edu/county/jeffco/natural/plant_images/quercus_gambelii_1_main_400x271.jpg,GAMBEL OAK,scrub oak,Quercus gambelii,"leaves usually over 2 inches long, not rigid.",3,5,"foothills, Jefferson County and south at 5,000 to 9,000 feet elevation."
http://extension.colostate.edu/county/jeffco/natural/plant_images/rhus_aromatica_400x271.jpg,THREE-LEAF SUMAC,"skunkbrush, lemonadebush, squawbush",Rhus aromatica,"arching branches form dense, rounded shrub.  Red, hairy fruits; 3-parted leaves resemble poison ivy, to which skunkbrush is related, on a smaller scale.",3,5,"canyonsides and rimrock at 4,000 to 8,000 feet elevation.l"
http://extension.colostate.edu/county/jeffco/natural/plant_images/ribes_inerme_400x258.jpg,MOUNTAIN GOOSEBERRY,"common gooseberry, wild gooseberry",Ribes inerme,"stems with both prickles and spines; hypanthium (fused bases of stamens, petals and sepals) tubular.",3,5,"shaded, moist areas at 6,000 to 10,000 feet elevation."
http://extension.colostate.edu/county/jeffco/natural/plant_images/ribes_montigenum_400x269.jpg,RED PRICKLY CURRANT,gooseberry currant,Ribes montigenum,low spreading shrub; leaves pubescent and glandular; spines 3 at node.,6,6,wet meadows and willow fens.
http://extension.colostate.edu/county/jeffco/natural/plant_images/rosa_woodsii_1_main_400x316.jpg,WOODS ROSE,wild rose,Rosa woodsii,"leaflets 5 - 7; flowering stems with broad-based thorns, occasional bristles; sepals 2 mm wide at base.",6,8,"valleys, gulches, trailsides at 6,000 to 11,000 feet elevation."
http://extension.colostate.edu/county/jeffco/natural/plant_images/rubus_idaeus_375x400.jpg,WILD RED RASPBERRY,wild raspberry,Rubus idaeus,stems with prickles; leaves glaucous (contains white waxy covering) underneath.,6,8,moist forests and slopes.
http://extension.colostate.edu/county/jeffco/natural/plant_images/senecio_integerrimus_400x300.jpg,EARLY SPRING SENECIO,"common spring senecio, lambstongue groundsel, tall golden ragwort",Senecio integerrimus,"pubescent (hairy), losing most pubescence in age; terminal head shorter than others.",3,6,moist meadows and slopes.
http://extension.colostate.edu/county/jeffco/natural/plant_images/sphaeralcea_coccinea_1_main_294x400.jpg,COWBOY'S DELIGHT,"copper mallow, scarlet globemallow, scarlet falsemallow",Sphaeralcea coccinea,"lower leaves very deeply palmately (like a hand) divided, silvery from dense, stellate (star-shaped) hairs.",6,9,"roadsides, disturbed areas at 4,500 to 8,500 feet elevation."
http://extension.colostate.edu/county/jeffco/natural/plant_images/thalictrum_fendleri_289x400.jpg,FENDLER MEADOWRUE,white meadowrue,Thalictrum fendleri,flowers mostly unisexual (either male or female); anthers much longer than wide; upper and lower edges of fruits mostly convex.,3,6,"meadows, aspen groves from 5,000 to 9,500 feet elevation."
http://extension.colostate.edu/county/jeffco/natural/plant_images/tragopogon_dubius_1_main_303x400.jpg,YELLOW SALSIFY,goatsbeard,Tragopogon dubius,flowers shorter than the phyllaries (bracts - small leaf-like structures - below a composite flower head); peduncles (stalk of a flower cluster) swollen in fruit.,6,8,"dry, hot valleys."
http://extension.colostate.edu/county/jeffco/natural/plant_images/urtica_gracilis_345x400.jpg,STINGING NETTLE,slender nettle,Urtica gracilis,leaves opposite (in pairs) glabrous (hairless) on upper surface with stinging hairs on lower surface.,6,9,"streamsides, irrigation ditches."
http://extension.colostate.edu/county/jeffco/natural/plant_images/vaccinium_myrtillus_400x336.jpg,MOUNTAIN BLUEBERRY,myrtle-leaf,Vaccinium myrtillus,"leaves more than 10 mm., serrate from base to end; branchlets angled, green.",6,8,"forest openings and rocky areas, 7500 - 12,500 ft."
http://extension.colostate.edu/county/jeffco/natural/plant_images/viola_adunca_373x400.jpg,EARLY BLUE VIOLET,mountain blue violet,Viola adunca,leaves pubescent (hairy); leaves seldom clearly cordate (heart-shaped).,5,8,"meadows, streamsides, aspen groves."
http://extension.colostate.edu/county/jeffco/natural/plant_images/viola_nuttallii_1_main_400x385.jpg,NUTTALL VIOLET,"yellow violet, yellow prairie violet",Viola nuttallii,"leaves narrowly lanceolate (lance-shaped) or lance-elliptic (oval), at least 3 times long as wide.",3,7,"meadows, open slopes, often blooming in the protection of rocks at 5,000 to 11,500 feet elevation."
